{
  "schema_version": "0.2.11",
  "surface_id": "surface:reference-base-current",
  "generated_at": "2026-08-23T03:55:00+08:00",
  "method": "joint_empirical_binomial_simplex_surface_v1",
  "base_snapshot_id": "snapshot:base",
  "current_snapshot_id": "snapshot:current",
  "comparison_id": "comparison:base-current",
  "measurement_contract": {
    "unit": "interaction_depth",
    "reliability_p": 0.9,
    "scope_id": "scope:reference",
    "assessment_method": "monotone_binomial_pava_v1"
  },
  "families": [
    "code",
    "research"
  ],
  "point_reference_family_weights": {
    "code": 0.5,
    "research": 0.5
  },
  "resampling": {
    "method": "stratified_empirical_binomial_sha256_v1",
    "seed": "ctcl-itr-v0.2.11-reference-20260823",
    "replicates": 256,
    "interval_p": 0.9,
    "minimum_supported_fraction": 0.5
  },
  "mixture_grid": {
    "method": "simplex_grid_reference_mixture_v1",
    "grid_step": 0.1,
    "minimum_family_weight": 0.1,
    "max_grid_points": 1000,
    "total_points": 9
  },
  "conditioning": {
    "outcome_counts_resampled": true,
    "trial_counts_fixed": true,
    "observed_family_weights_fixed": true,
    "reference_mixture_varied": true,
    "mixture_weights_resampled": false,
    "same_resampled_outcomes_reused_across_mixture_cells": true,
    "surface_cells_are_independent": false
  },
  "subjects": {
    "autonomy": {
      "cells": [
        {
          "reference_family_weights": {
            "code": 0.1,
            "research": 0.9
          },
          "point_estimate": {
            "support_status": "supported",
            "support_reasons": [],
            "composition_adjusted_delta": 0.4475095785440599,
            "reference_base_horizon": 6.041379310344828,
            "reference_current_horizon": 6.488888888888888
          },
          "resampling": {
            "supported_replicates": 215,
            "total_replicates": 256,
            "supported_fraction": 0.83984375,
            "support_status": "supported",
            "band": {
              "lower": -0.28587928425552717,
              "median": 0.3770625798212004,
              "upper": 1.6664876934170851
            },
            "mean": 0.4880856209671685,
            "sign_shares": {
              "positive": 0.827906976744186,
              "negative": 0.17209302325581396,
              "zero": 0.0
            },
            "band_sign_class": "crosses_zero",
            "unsupported_reason_counts": {
              "base_observed:family_unsupported:research": 2,
              "base_observed:target_not_bracketed_high": 64,
              "base_reference:family_unsupported:research": 2,
              "current_observed:family_unsupported:code": 40,
              "current_observed:target_not_bracketed_high": 1,
              "current_reference:family_unsupported:code": 40,
              "family_unsupported:code": 40,
              "family_unsupported:research": 2,
              "target_not_bracketed_high": 65
            }
          }
        },
        {
          "reference_family_weights": {
            "code": 0.2,
            "research": 0.8
          },
          "point_estimate": {
            "support_status": "supported",
            "support_reasons": [],
            "composition_adjusted_delta": 0.5076923076923077,
            "reference_base_horizon": 6.092307692307692,
            "reference_current_horizon": 6.6
          },
          "resampling": {
            "supported_replicates": 214,
            "total_replicates": 256,
            "supported_fraction": 0.8359375,
            "support_status": "supported",
            "band": {
              "lower": -0.2399068322981354,
              "median": 0.4358508158508161,
              "upper": 1.695597768732096
            },
            "mean": 0.5422480773640594,
            "sign_shares": {
              "positive": 0.8644859813084113,
              "negative": 0.13551401869158877,
              "zero": 0.0
            },
            "band_sign_class": "crosses_zero",
            "unsupported_reason_counts": {
              "base_observed:family_unsupported:research": 2,
              "base_observed:target_not_bracketed_high": 64,
              "base_reference:family_unsupported:research": 2,
              "current_observed:family_unsupported:code": 40,
              "current_observed:target_not_bracketed_high": 1,
              "current_reference:family_unsupported:code": 40,
              "current_reference:target_not_bracketed_high": 1,
              "family_unsupported:code": 40,
              "family_unsupported:research": 2,
              "target_not_bracketed_high": 65
            }
          }
        },
        {
          "reference_family_weights": {
            "code": 0.3,
            "research": 0.7
          },
          "point_estimate": {
            "support_status": "supported",
            "support_reasons": [],
            "composition_adjusted_delta": 0.5863354037267063,
            "reference_base_horizon": 6.156521739130435,
            "reference_current_horizon": 6.742857142857141
          },
          "resampling": {
            "supported_replicates": 214,
            "total_replicates": 256,
            "supported_fraction": 0.8359375,
            "support_status": "supported",
            "band": {
              "lower": -0.13389155400815522,
              "median": 0.5090799031476996,
              "upper": 1.7403064060189826
            },
            "mean": 0.6248094892832463,
            "sign_shares": {
              "positive": 0.9018691588785047,
              "negative": 0.09813084112149532,
              "zero": 0.0
            },
            "band_sign_class": "crosses_zero",
            "unsupported_reason_counts": {
              "base_observed:family_unsupported:research": 2,
              "base_observed:target_not_bracketed_high": 64,
              "base_reference:family_unsupported:research": 2,
              "current_observed:family_unsupported:code": 40,
              "current_observed:target_not_bracketed_high": 1,
              "current_reference:family_unsupported:code": 40,
              "current_reference:target_not_bracketed_high": 1,
              "family_unsupported:code": 40,
              "family_unsupported:research": 2,
              "target_not_bracketed_high": 65
            }
          }
        },
        {
          "reference_family_weights": {
            "code": 0.4,
            "research": 0.6
          },
          "point_estimate": {
            "support_status": "supported",
            "support_reasons": [],
            "composition_adjusted_delta": 0.6933333333333334,
            "reference_base_horizon": 6.24,
            "reference_current_horizon": 6.933333333333334
          },
          "resampling": {
            "supported_replicates": 211,
            "total_replicates": 256,
            "supported_fraction": 0.82421875,
            "support_status": "supported",
            "band": {
              "lower": -0.07969987002245049,
              "median": 0.6363084395871281,
              "upper": 1.8013565381986432
            },
            "mean": 0.7144483962550611,
            "sign_shares": {
              "positive": 0.9383886255924171,
              "negative": 0.061611374407582936,
              "zero": 0.0
            },
            "band_sign_class": "crosses_zero",
            "unsupported_reason_counts": {
              "base_observed:family_unsupported:research": 2,
              "base_observed:target_not_bracketed_high": 64,
              "base_reference:family_unsupported:research": 2,
              "current_observed:family_unsupported:code": 40,
              "current_observed:target_not_bracketed_high": 1,
              "current_reference:family_unsupported:code": 40,
              "current_reference:target_not_bracketed_high": 4,
              "family_unsupported:code": 40,
              "family_unsupported:research": 2,
              "target_not_bracketed_high": 67
            }
          }
        },
        {
          "reference_family_weights": {
            "code": 0.5,
            "research": 0.5
          },
          "point_estimate": {
            "support_status": "supported",
            "support_reasons": [],
            "composition_adjusted_delta": 0.8470588235294114,
            "reference_base_horizon": 6.352941176470588,
            "reference_current_horizon": 7.199999999999999
          },
          "resampling": {
            "supported_replicates": 193,
            "total_replicates": 256,
            "supported_fraction": 0.75390625,
            "support_status": "supported",
            "band": {
              "lower": -0.09468531468531484,
              "median": 0.7733333333333325,
              "upper": 1.770461538461536
            },
            "mean": 0.7910630520472455,
            "sign_shares": {
              "positive": 0.9430051813471503,
              "negative": 0.05699481865284974,
              "zero": 0.0
            },
            "band_sign_class": "crosses_zero",
            "unsupported_reason_counts": {
              "base_observed:family_unsupported:research": 2,
              "base_observed:target_not_bracketed_high": 64,
              "base_reference:family_unsupported:research": 2,
              "current_observed:family_unsupported:code": 40,
              "current_observed:target_not_bracketed_high": 1,
              "current_reference:family_unsupported:code": 40,
              "current_reference:target_not_bracketed_high": 22,
              "family_unsupported:code": 40,
              "family_unsupported:research": 2,
              "target_not_bracketed_high": 81
            }
          }
        },
        {
          "reference_family_weights": {
            "code": 0.6,
            "research": 0.4
          },
          "point_estimate": {
            "support_status": "supported",
            "support_reasons": [],